URL,Title,Location,Salary,Summary
https://kr.indeed.com/jobs?jk=,,성남 수정구,,"인원 [담당업무] Python, C++, MFC, C를 이용하여 - OpenCV 로 Visual SLAM 개발- MFC, Python을 이용하여 GUI... 통신·모바일·게임>응용프로그래머> Python|인터넷·IT·통신·모바일·게임..."
https://kr.indeed.com/jobs?jk=,,서울 종로구,,어노테이션 파일 구성 및 형식 등 데이터 설계.2. 각 의료기관에서 수집된 액티그래피 데이터의 정제를 위한 Python 및 R 코드 개발.3. 수집된 데이터의 판독 및 검수 프로세스 관리4. 데이터 유효성 검증을 위한 AI...
https://kr.indeed.com/jobs?jk=,,서울 관악구,,"성별 : 무관 - 모집인원 : 0명 [기술 지원자격] - Linux 환경 개발 경력 - C/Java/ Python 개발 경력 - 서버 개발/운영 경력 [우대사항] - 자연어처리, 정보검색, 기계학습, 데이터 마이닝..."
https://kr.indeed.com/jobs?jk=,,성남 분당구,,"30대 정도 과장/대리급) - 서버 OS(Linux / Windows), 네트워크 지식 보유- Shell, Python 등 스크립트 언어 개발 능력- 시스템 장애 대응 및 조치 경험이 있으신 분- 시스템 개선을 위해 끊임없이..."
https://kr.indeed.com/jobs?jk=,,서울 성동구,,우대 사항3D 콘텐츠 개발 경험 (VR/AR)커뮤니케이션 (문서 작성 및 토론 능력)Unreal 개발 능력 Python 등 script 언어 사용MacOS / Linux 개발 환경 경험[근무부서 및 직급/직책]근무부서: 개발팀...
https://kr.indeed.com/jobs?jk=,,서울 강남구,,"이상의 유관 업무 경험 우대사항 GA, Tableau, SQL, Python 등 기본적인 데이터 분석 역량이 있으신 분 Zapier, Airtable... DBA>SQL|인터넷·IT·통신·모바일·게임>응용프로그래머> Python"
https://kr.indeed.com/jobs?jk=,,성남 분당구,,인터넷·IT·통신·모바일·게임>응용프로그래머> Python|인터넷·IT·통신·모바일·게임>빅데이터·AI(인공지능)> Python|인터넷·IT·통신·모바일·게임>웹프로그래머> Python|인터넷·IT·통신·모바일·게임>네트워크·서버...
https://kr.indeed.com/jobs?jk=,,성남 판교역,,"기술을 서비스에 적용하기 위한 MLOps 플랫폼을 개발합니다. 지원자격 학력 : 석사 이상 필수조건 - Python, Java등 한 가지 이상의 컴퓨터 프로그래밍 언어를 활용할 수 있으신 분 - 머신러닝/딥러닝 기술에 대한..."
https://kr.indeed.com/jobs?jk=,,서울 중구,,보유 경력 : 3년 이상- 학력/전공 : 학사 이상 / 전공 무관- Python 프로그래밍 역량 보유- Airflow와 같은 Workflow 도구를... 통신·모바일·게임>응용프로그래머> Python|인터넷·IT·통신·모바일·게임...
https://kr.indeed.com/jobs?jk=,,성남 판교역,,"분 - 통계/Machine Learning에 대한 이해와 활용 능력 및 text 처리 기술에 대한 경험 - Python, Java 등을 이용하여 NLP 기술을 구현 가능한 분 - 최신 기술(논문, 기술문서 등)을 습득하는..."
https://kr.indeed.com/jobs?jk=,,서울 영등포구,,인터넷·IT·통신·모바일·게임>응용프로그래머>C·C++|인터넷·IT·통신·모바일·게임>응용프로그래머> Python|인터넷·IT·통신·모바일·게임>응용프로그래머>머신러닝(ML)|인터넷·IT·통신·모바일·게임>빅데이터·AI(인공지...
https://kr.indeed.com/jobs?jk=,,서울 노원구,,게임>빅데이터·AI(인공지능)> Python|인터넷·IT·통신·모바일·게임... 조사·분석·통계>설문·리서치·모니터링|인터넷·IT·통신·모바일·게임>웹프로그래머> Python|인터넷·IT·통신·모바일·게임>응용프로그래머> Python
https://kr.indeed.com/jobs?jk=,,서울,,"DRAM memories 5 years experience in C/C+ programming, Python, Memory Reference Code (MRC... BIOS 5 years experience..."
https://kr.indeed.com/jobs?jk=,,서울 서초구,,인터넷·IT·통신·모바일·게임>웹프로그래머>백엔드|인터넷·IT·통신·모바일·게임>ERP·시스템분석·설계>시스템엔지니어|인터넷·IT·통신·모바일·게임>전산·IT기술지원>유지보수
https://kr.indeed.com/jobs?jk=,,서울 중구,,"Kubenetes, Python담당 직무11번가 Infra 조직은 현재... Kubernetes 및 Docker을 이용한 시스템 구축 경험이 있으신 분 Python, Shell, Java 등의 언어를 사용하여 운영 관리 도구를..."
https://kr.indeed.com/jobs?jk=,,서울,,"분 - 세그먼트 추출, 스코어 모델, 예측 모델, 마케팅 자동화 구축 경험이 있는 분 - SQL, R, Python, MS Excel 및 프로젝트 관리 도구 사용이 익숙하신 분 - Platform 비지니스에 대한 이해, 사업..."
https://kr.indeed.com/jobs?jk=,,경기도 성남,,"Phoenix DB 개발 유지 보수 [ 자격요건] - 경력 4년 이상이신 분 - PHP, Java, Python, Apache, Html5, MySQL Javascript, Linux 등 웹서비스 개발 지식과 경험이..."
https://kr.indeed.com/jobs?jk=,,서울 종로구,,통신·모바일·게임>웹프로그래머> Python|인터넷·IT·통신·모바일·게임... 로그래머>머신러닝(ML)|인터넷·IT·통신·모바일·게임>응용프로그래머> Python|인터넷·IT·통신·모바일·게임>응용프로그래머>증강현실(AR)|인터넷...
https://kr.indeed.com/jobs?jk=,,서울,,로그래머>백엔드|인터넷·IT·통신·모바일·게임>웹프로그래머>프론트엔드|인터넷·IT·통신·모바일·게임>웹프로그래머> Python|인터넷·IT·통신·모바일·게임>웹프로그래머>ASP.NET|인터넷·IT·통신·모바일·게임>웹프로그래머...
